{
  "schema_version": 1,
  "run_id": "2026-04-27T05-39-50Z__de06d564e9",
  "timestamp": "2026-04-27T05:39:50.974899+00:00",
  "machine": {
    "fingerprint": "de06d564e9",
    "cpu_model": "Intel(R) Xeon(R) CPU @ 2.80GHz",
    "cpu_arch": "x86_64",
    "physical_cores": 4,
    "logical_cores": 8,
    "memory_gb": 31.3,
    "os": "Linux 6.17.0-1012-gcp",
    "kernel": "#12~24.04.1-Ubuntu SMP Fri Mar 27 23:35:04 UTC 2026",
    "label": "n2-standard-8"
  },
  "toolchain": {
    "rustc": "rustc 1.95.0 (59807616e 2026-04-14)",
    "git_shas": {
      "leanmultisig_sha": "1ad5fe259b748a78195a8c67353989650ea3d410",
      "leansig_sha": "16c660e93c60240de113fdca6be7455d6d7721a1"
    }
  },
  "workloads": [
    {
      "name": "leansig.sign",
      "unit": "ns",
      "samples_ns": [
        552572,
        549624,
        560645,
        599864,
        549682,
        587727,
        552655,
        559080,
        579778,
        520670,
        589850,
        553945,
        531007,
        562222,
        570738,
        565947,
        569882,
        561373,
        578565,
        542132,
        514179,
        614230,
        563918,
        534554,
        537887,
        534053,
        532089,
        547904,
        536811,
        536977
      ],
      "timing": {
        "n": 30,
        "mean_ns": 556352,
        "stddev_ns": 23317,
        "min_ns": 514179,
        "p50_ns": 553945,
        "p95_ns": 589850,
        "max_ns": 614230
      },
      "resources": {
        "cpu_percent": {
          "mean": 795.0,
          "peak": 807.5
        },
        "rss_bytes": {
          "mean": 5310548,
          "peak": 5722112
        },
        "n_samples": 1648,
        "interval_ms": 100
      },
      "meta": {
        "lifetime_log2": 20,
        "message_bytes": 32,
        "signature_bytes": 1688,
        "variant": "SIGTargetSumLifetime20W4NoOff"
      }
    },
    {
      "name": "leansig.verify",
      "unit": "ns",
      "samples_ns": [
        415295,
        417758,
        414807,
        417251,
        411073,
        416620,
        420226,
        414737,
        416642,
        413727,
        410901,
        419420,
        414450,
        416075,
        413739,
        416547,
        411457,
        415165,
        419764,
        413881,
        416779,
        419225,
        414276,
        416937,
        416048,
        416669,
        413359,
        416973,
        410835,
        413788
      ],
      "timing": {
        "n": 30,
        "mean_ns": 415480,
        "stddev_ns": 2549,
        "min_ns": 410835,
        "p50_ns": 416048,
        "p95_ns": 419420,
        "max_ns": 420226
      },
      "resources": {
        "cpu_percent": {
          "mean": 795.3,
          "peak": 804.2
        },
        "rss_bytes": {
          "mean": 5398277,
          "peak": 5681152
        },
        "n_samples": 1649,
        "interval_ms": 100
      },
      "meta": {
        "lifetime_log2": 20,
        "signature_bytes": 1688,
        "variant": "SIGTargetSumLifetime20W4NoOff"
      }
    },
    {
      "name": "xmss.sign",
      "unit": "ns",
      "samples_ns": [
        431313822,
        739302064,
        44363515,
        237166648,
        815548920,
        131840291,
        149651371,
        18608094,
        295815146,
        184620857,
        427567542,
        658939474,
        220946318,
        74528947,
        734145064,
        126011246,
        605044108,
        713590496,
        21280427,
        180366474,
        660322832,
        207733774,
        262419255,
        64675341,
        390663267,
        137547105,
        60264513,
        1045809219,
        322160533,
        103719351
      ],
      "timing": {
        "n": 30,
        "mean_ns": 335532200,
        "stddev_ns": 282254560,
        "min_ns": 18608094,
        "p50_ns": 237166648,
        "p95_ns": 739302064,
        "max_ns": 1045809219
      },
      "resources": {
        "cpu_percent": {
          "mean": 99.0,
          "peak": 106.7
        },
        "rss_bytes": {
          "mean": 4238769,
          "peak": 4268032
        },
        "n_samples": 104,
        "interval_ms": 100
      },
      "meta": {
        "message_len_fe": 9,
        "signature_bytes": 2917
      }
    },
    {
      "name": "xmss.verify",
      "unit": "ns",
      "samples_ns": [
        547231,
        542152,
        545694,
        542004,
        544706,
        542302,
        545476,
        548070,
        544697,
        544752,
        546406,
        545462,
        542791,
        544935,
        542455,
        545495,
        543004,
        544629,
        547111,
        541327,
        548467,
        549355,
        544789,
        542436,
        551520,
        544510,
        545071,
        541749,
        544511,
        547946
      ],
      "timing": {
        "n": 30,
        "mean_ns": 545035,
        "stddev_ns": 2459,
        "min_ns": 541327,
        "p50_ns": 544789,
        "p95_ns": 548467,
        "max_ns": 551520
      },
      "resources": {
        "cpu_percent": {
          "mean": 0.0,
          "peak": 0.0
        },
        "rss_bytes": {
          "mean": 1294336,
          "peak": 1294336
        },
        "n_samples": 1,
        "interval_ms": 100
      },
      "meta": {
        "signature_bytes": 2915
      }
    }
  ],
  "notes": ""
}
