{
  "schema_version": 1,
  "run_id": "2026-04-24T10-57-40Z__a0805c1f4c",
  "timestamp": "2026-04-24T10:57:40.326793+00:00",
  "machine": {
    "fingerprint": "a0805c1f4c",
    "cpu_model": "Apple M1 Max",
    "cpu_arch": "arm64",
    "physical_cores": 10,
    "logical_cores": 10,
    "memory_gb": 64.0,
    "os": "Darwin 24.6.0",
    "kernel": "Darwin Kernel Version 24.6.0: Mon Aug 11 21:16:21 PDT 2025; root:xnu-11417.140.69.701.11~1/RELEASE_ARM64_T6000",
    "label": "apple-m1-max"
  },
  "toolchain": {
    "rustc": "rustc 1.94.0 (4a4ef493e 2026-03-02)",
    "git_shas": {
      "leanmultisig_sha": "1ad5fe259b748a78195a8c67353989650ea3d410",
      "leansig_sha": "16c660e93c60240de113fdca6be7455d6d7721a1"
    }
  },
  "workloads": [
    {
      "name": "leansig.sign",
      "unit": "ns",
      "samples_ns": [
        380292,
        448792,
        301333,
        309291,
        285209,
        461792,
        292042,
        438875,
        408875,
        334875,
        385333,
        338708,
        343500,
        364375,
        299458,
        338583,
        408958,
        294292,
        313166,
        323542,
        296291,
        311750,
        301000,
        322959,
        275833,
        283208,
        290625,
        297084,
        295083,
        305625
      ],
      "timing": {
        "n": 30,
        "mean_ns": 335024,
        "stddev_ns": 52954,
        "min_ns": 275833,
        "p50_ns": 313166,
        "p95_ns": 438875,
        "max_ns": 461792
      },
      "resources": {
        "cpu_percent": {
          "mean": 915.6,
          "peak": 981.5
        },
        "rss_bytes": {
          "mean": 8188373,
          "peak": 9633792
        },
        "n_samples": 131,
        "interval_ms": 100
      },
      "meta": {
        "lifetime_log2": 20,
        "message_bytes": 32,
        "signature_bytes": 1688,
        "variant": "SIGTargetSumLifetime20W4NoOff"
      }
    },
    {
      "name": "leansig.verify",
      "unit": "ns",
      "samples_ns": [
        349375,
        345375,
        343375,
        344250,
        346750,
        344292,
        343541,
        344208,
        343500,
        346167,
        345541,
        344125,
        343417,
        344250,
        343375,
        347833,
        343250,
        344083,
        343125,
        344541,
        343542,
        348333,
        343250,
        344500,
        343542,
        348625,
        344375,
        347250,
        343250,
        343750
      ],
      "timing": {
        "n": 30,
        "mean_ns": 344826,
        "stddev_ns": 1817,
        "min_ns": 343125,
        "p50_ns": 344250,
        "p95_ns": 348333,
        "max_ns": 349375
      },
      "resources": {
        "cpu_percent": {
          "mean": 898.6,
          "peak": 981.7
        },
        "rss_bytes": {
          "mean": 8377521,
          "peak": 9306112
        },
        "n_samples": 133,
        "interval_ms": 100
      },
      "meta": {
        "lifetime_log2": 20,
        "signature_bytes": 1688,
        "variant": "SIGTargetSumLifetime20W4NoOff"
      }
    },
    {
      "name": "xmss.sign",
      "unit": "ns",
      "samples_ns": [
        274588042,
        466589750,
        28396000,
        149532750,
        519796292,
        84069834,
        96240791,
        11928500,
        188588875,
        119512584,
        271602625,
        419321958,
        140475083,
        47757209,
        466239833,
        80943333,
        385853291,
        456806375,
        13623833,
        115469250,
        421004208,
        132376542,
        166905000,
        41139125,
        246598209,
        88433917,
        37623583,
        656724458,
        202254459,
        65247500
      ],
      "timing": {
        "n": 30,
        "mean_ns": 213188106,
        "stddev_ns": 178763856,
        "min_ns": 11928500,
        "p50_ns": 149532750,
        "p95_ns": 466589750,
        "max_ns": 656724458
      },
      "resources": {
        "cpu_percent": {
          "mean": 99.3,
          "peak": 107.0
        },
        "rss_bytes": {
          "mean": 4734976,
          "peak": 4816896
        },
        "n_samples": 61,
        "interval_ms": 100
      },
      "meta": {
        "message_len_fe": 9,
        "signature_bytes": 2917
      }
    },
    {
      "name": "xmss.verify",
      "unit": "ns",
      "samples_ns": [
        360458,
        357750,
        357833,
        358083,
        360417,
        360958,
        357708,
        358625,
        361000,
        360125,
        359000,
        358084,
        357917,
        361291,
        357875,
        359375,
        357917,
        357750,
        358000,
        358541,
        361417,
        359334,
        360792,
        358208,
        359833,
        357709,
        359709,
        358334,
        361000,
        358084
      ],
      "timing": {
        "n": 30,
        "mean_ns": 359104,
        "stddev_ns": 1300,
        "min_ns": 357708,
        "p50_ns": 358625,
        "p95_ns": 361000,
        "max_ns": 361417
      },
      "resources": {
        "cpu_percent": {
          "mean": 32.7,
          "peak": 32.7
        },
        "rss_bytes": {
          "mean": 344064,
          "peak": 344064
        },
        "n_samples": 1,
        "interval_ms": 100
      },
      "meta": {
        "signature_bytes": 2915
      }
    },
    {
      "name": "aggregate.flat_1000_r2",
      "unit": "ns",
      "samples_ns": [
        3804000209,
        3671761125,
        3698666750,
        3790461000,
        3651866708,
        3740313208,
        3618940667,
        3829618833,
        3763987667,
        3782359584,
        3641781875,
        3716080417,
        3645536625,
        3678251167,
        3610343416,
        3708589334,
        3722030542,
        3724514833,
        3864720292,
        3696643709,
        3594485500,
        3701295250,
        3615804000,
        3844751750,
        3827519833,
        3862618209,
        3717678541,
        3678423125,
        3654290584,
        3672456250
      ],
      "timing": {
        "n": 30,
        "mean_ns": 3717659700,
        "stddev_ns": 78250790,
        "min_ns": 3594485500,
        "p50_ns": 3708589334,
        "p95_ns": 3844751750,
        "max_ns": 3864720292
      },
      "resources": {
        "cpu_percent": {
          "mean": 780.8,
          "peak": 998.2
        },
        "rss_bytes": {
          "mean": 4952945891,
          "peak": 8010088448
        },
        "n_samples": 1106,
        "interval_ms": 100
      },
      "meta": {
        "log_inv_rate": 2,
        "raw_xmss": 1000,
        "topology": "flat"
      }
    },
    {
      "name": "aggregate.tree_2x500_r2",
      "unit": "ns",
      "samples_ns": [
        5269772791,
        5449099042,
        5418168833,
        5476495000,
        5403063583,
        5498591209,
        5373116709,
        5363884708,
        5333294542,
        5419970833,
        5331594458,
        5410363292,
        5468079416,
        5553977459,
        5626292167,
        5960221792,
        5853044625,
        5944338291,
        6079210875,
        5966752875,
        6262583291,
        6146836500,
        6145221208,
        5697166333,
        5819397041,
        5983699708,
        5850813708,
        5680183500,
        5702146208,
        5806431708
      ],
      "timing": {
        "n": 30,
        "mean_ns": 5676460390,
        "stddev_ns": 289578432,
        "min_ns": 5269772791,
        "p50_ns": 5680183500,
        "p95_ns": 6145221208,
        "max_ns": 6262583291
      },
      "resources": {
        "cpu_percent": {
          "mean": 728.7,
          "peak": 980.0
        },
        "rss_bytes": {
          "mean": 4192038757,
          "peak": 4977475584
        },
        "n_samples": 1646,
        "interval_ms": 100
      },
      "meta": {
        "fan_in": 2,
        "leaf_raw_xmss": 500,
        "log_inv_rate": 2,
        "note": "total wall time includes both leaves; subtract 2 \u00d7 aggregate.flat_500_r2 for recursion-only cost",
        "topology": "2-to-1 recursion"
      }
    }
  ],
  "notes": ""
}
